{
  "schema": 3,
  "kind": "MIR4ChangeFragmentV3",
  "change_id": "MIR4-CHG-2026-0094",
  "status": "draft",
  "change_type": "changed",
  "summary": "Preserve material-audit definitions while refusing retired native staging.",
  "details": [
    "The unconverted Angel Tin, combined Bob/Angel Tin, route-safety and Aluminium native entry points now refuse before staging. Their original archive locks and gameplay oracles remain available for later direct-library conversion; existing log-audit and candidate-binding modes retain their stated scope.",
    "The existing test and workflow catalogue writers track the current commands and inputs. Historical and controlled input evidence supplies no new native material, lifecycle or release pass."
  ],
  "semantic_domains": [
    "tooling",
    "documentation"
  ],
  "audiences": [
    "contributors",
    "maintainers"
  ],
  "target_dispositions": [
    {
      "target": "F210",
      "disposition": "affected",
      "reason": "Changes developer capture staging; no player source or native qualification."
    },
    {
      "target": "F200",
      "disposition": "affected",
      "reason": "Changes developer capture staging; no player source or native qualification."
    },
    {
      "target": "F110",
      "disposition": "unaffected",
      "reason": "No player source or target qualification changes."
    },
    {
      "target": "F100",
      "disposition": "unaffected",
      "reason": "No player source or target qualification changes."
    },
    {
      "target": "F017",
      "disposition": "unaffected",
      "reason": "No player source or target qualification changes."
    },
    {
      "target": "F016",
      "disposition": "unaffected",
      "reason": "No player source or target qualification changes."
    },
    {
      "target": "F015",
      "disposition": "unaffected",
      "reason": "No player source or target qualification changes."
    },
    {
      "target": "F014",
      "disposition": "unaffected",
      "reason": "No player source or target qualification changes."
    },
    {
      "target": "F013",
      "disposition": "unaffected",
      "reason": "No player source or target qualification changes."
    }
  ],
  "package_visibility": "repository-only",
  "impacts": {
    "save": "none",
    "settings": "none",
    "migration": "none",
    "compatibility": "none",
    "public_contract": "changed",
    "support_claim": "none"
  },
  "security_visibility": "public-at-merge",
  "release_surfaces": {
    "source_changelog": "include",
    "target_changelog": "omit",
    "github": "omit",
    "mod_portal": "omit",
    "technical": "include",
    "manifest": "include"
  },
  "references": [
    {
      "kind": "finding",
      "value": "tests/support/MIRMaterialAuditInputs.ps1"
    },
    {
      "kind": "finding",
      "value": "tools/mir/application/tooling/TestWorkflowCatalogues.ps1"
    }
  ]
}
